{
  "name": "planning-with-files",
  "version": "1.0.0",
  "description": "大项目救星 — 持久化项目规划，跨会话不丢失上下文，适合碎片化时间开发。将需求拆解为可跟踪的文件化任务清单。",
  "category": "productivity",
  "compatibility": [
    "claude-code",
    "codex",
    "kimi-code",
    "opencode",
    "codewhale"
  ],
  "keywords": [
    "planning",
    "persistence",
    "task-management",
    "cross-session",
    "project-management"
  ],
  "author": {
    "name": "Platform Team"
  },
  "license": "MIT"
}